{
  "schema_version": 1,
  "id": "architecture.camilobuilder",
  "record_version": "1.0.0",
  "architecture_version": "1.0.0",
  "constitution_version": "1.0.0",
  "status": "active",
  "builders": ["builder.agent", "builder.project"],
  "commands": ["command.create-agent", "command.create-project"],
  "component_types": ["component.agent", "component.project"],
  "templates": ["template.agent-default", "template.project-default"],
  "contract_ids": ["contract.cli"],
  "capability_ids": ["capability.create-agent"],
  "dependency_ids": [],
  "source_commit": "ac2f00def074e5bee7c50753e9bc9af82b655bd2"
}
